RowType,Stem,OptionA,OptionB,OptionC,OptionD,CorrectOption,Explanation,Category,Subject,Topic,Subtopic,Difficulty,Marks,NegativeMarks,SourceTag,GroupId
QUESTION,"What is the capital of India?","Delhi","Mumbai","Kolkata","Chennai","A","Delhi is the capital of India since 1911.",Polity,Indian Polity,Constitutional Bodies,Parliament,FOUNDATIONAL,1,0.25,NCERT_9,,
QUESTION,"Who is known as the Father of the Indian Constitution?","B.R. Ambedkar","Jawaharlal Nehru","Mahatma Gandhi","Sardar Patel","A","Dr. B.R. Ambedkar chaired the Drafting Committee.",Polity,Indian Polity,Fundamental Rights,Directive Principles,FOUNDATIONAL,1,0.25,NCERT_11,,
PASSAGE_START,"Read the following passage and answer questions 3 and 4. The Indian National Congress was founded in 1885 by A.O. Hume. It played a central role in India's independence movement and was led by numerous leaders including Dadabhai Naoroji Bal Gangadhar Tilak and Mahatma Gandhi. The party adopted a resolution for complete independence (Purna Swaraj) in 1929 at the Lahore session.",,,,,,,History,Modern History,Independence Movement,Congress Party,MODERATE,,,SOURCE_PIB,GROUP001
QUESTION,"In which year was the Indian National Congress founded?","1857","1885","1905","1920","B","The INC was founded on 28 December 1885 by A.O. Hume.",History,Modern History,Independence Movement,Congress Party,FOUNDATIONAL,1,0.25,SOURCE_PIB,GROUP001
QUESTION,"Where was the Purna Swaraj resolution passed?","Calcutta","Bombay","Lahore","Delhi","C","The Lahore session of 1929 adopted the Purna Swaraj resolution under Jawaharlal Nehru's presidency.",History,Modern History,Independence Movement,Congress Party,MODERATE,2,0.5,SOURCE_PIB,GROUP001
GROUP_END,,,,,,,,,,,,,,,,,GROUP001
QUESTION,"Which Article of the Indian Constitution abolishes untouchability?","Article 14","Article 15","Article 17","Article 21","C","Article 17 abolishes untouchability and forbids its practice in any form.",Polity,Indian Polity,Fundamental Rights,Equality Rights,MODERATE,1,0.25,NCERT_11,,
